{"$schema":"https://json-schema.org/draft/2020-12/schema","$id":"https://eliasworks.dev/blueprint/0.5.4-dev/functional-interface-slice.schema.json","title":"Blueprint Functional Interface Slice","type":"object","required":["schema_version","id","name","platform","inventory_ids","dependencies","api_binding","client_architecture","lifecycle_status","blocker","definition_of_done","visual_functional_review","integration_qa","human_acceptance","evidence_ids"],"properties":{"schema_version":{"enum":["0.5.0","0.5.4-dev"]},"id":{"type":"string","pattern":"^[a-z0-9][a-z0-9._-]*$"},"name":{"type":"string","minLength":1},"platform":{"enum":["web","android","ios"]},"inventory_ids":{"type":"array","minItems":1,"uniqueItems":true,"items":{"type":"string","pattern":"^(WEB|APP|IOS)-[0-9]{3}$"}},"dependencies":{"type":"array","uniqueItems":true,"items":{"type":"string","pattern":"^[a-z0-9][a-z0-9._-]*$"}},"api_binding":{"type":"object","required":["openapi_ref","revision","operation_ids"],"properties":{"openapi_ref":{"type":"string","minLength":1},"revision":{"type":"string","minLength":1},"operation_ids":{"type":"array","uniqueItems":true,"items":{"type":"string","minLength":1}}},"additionalProperties":false},"client_architecture":{"type":"object","required":["artifact","gate_status"],"properties":{"artifact":{"type":"string","minLength":1},"gate_status":{"enum":["PENDING","READY_FOR_REVIEW","PASS","FAIL","BLOCKED"]}},"additionalProperties":false},"lifecycle_status":{"enum":["INVENTORIED","READY","IN_PROGRESS","FUNCTIONAL","ACCEPTED"]},"blocker":{"oneOf":[{"type":"null"},{"type":"object","required":["id","type","category","description","opened_at","last_valid_lifecycle_status","current_contract_ref","evidence_ids","resolved"],"properties":{"id":{"type":"string","pattern":"^BLK-[A-Z0-9][A-Z0-9._-]*$"},"type":{"const":"BLOCKED_BY_API"},"category":{"enum":["data","operation","permission","state","transition","error_contract","other"]},"description":{"type":"string","minLength":1},"opened_at":{"type":"string","format":"date-time"},"last_valid_lifecycle_status":{"enum":["INVENTORIED","READY","IN_PROGRESS","FUNCTIONAL"]},"current_contract_ref":{"type":"string","minLength":1},"evidence_ids":{"type":"array","minItems":1,"uniqueItems":true,"items":{"type":"string","pattern":"^EVD-[A-Z0-9][A-Z0-9._-]*$"}},"resolved":{"type":"boolean"},"resolution":{"type":["object","null"],"properties":{"resolved_at":{"type":"string","format":"date-time"},"resolution_ref":{"type":"string","minLength":1},"evidence_ids":{"type":"array","minItems":1,"uniqueItems":true,"items":{"type":"string","pattern":"^EVD-[A-Z0-9][A-Z0-9._-]*$"}}},"required":["resolved_at","resolution_ref","evidence_ids"],"additionalProperties":false}},"allOf":[{"if":{"properties":{"resolved":{"const":true}},"required":["resolved"]},"then":{"required":["resolution"]}},{"if":{"properties":{"resolved":{"const":false}},"required":["resolved"]},"then":{"properties":{"resolution":{"type":"null"}}}}],"additionalProperties":false}]},"definition_of_done":{"type":"object","required":["status","checks","evidence_ids"],"properties":{"status":{"enum":["PENDING","PASS","FAIL","BLOCKED"]},"checks":{"type":"object","required":["routing","real_api","auth_rbac","forms_errors","observability","responsive","accessibility","tests","traceability","no_hardcoded_business_data","no_invented_capabilities"],"properties":{"routing":{"enum":["PENDING","PASS","FAIL","N/A"]},"real_api":{"enum":["PENDING","PASS","FAIL","N/A"]},"auth_rbac":{"enum":["PENDING","PASS","FAIL","N/A"]},"forms_errors":{"enum":["PENDING","PASS","FAIL","N/A"]},"observability":{"enum":["PENDING","PASS","FAIL","N/A"]},"responsive":{"enum":["PENDING","PASS","FAIL","N/A"]},"accessibility":{"enum":["PENDING","PASS","FAIL","N/A"]},"tests":{"enum":["PENDING","PASS","FAIL","N/A"]},"traceability":{"enum":["PENDING","PASS","FAIL"]},"no_hardcoded_business_data":{"enum":["PENDING","PASS","FAIL"]},"no_invented_capabilities":{"enum":["PENDING","PASS","FAIL"]},"idempotency":{"enum":["PENDING","PASS","FAIL","N/A"]},"offline":{"enum":["PENDING","PASS","FAIL","N/A"]}},"additionalProperties":false},"evidence_ids":{"type":"array","uniqueItems":true,"items":{"type":"string","pattern":"^EVD-[A-Z0-9][A-Z0-9._-]*$"}}},"additionalProperties":false},"visual_functional_review":{"type":"object","required":["status","evidence_ids","human_complete"],"properties":{"status":{"enum":["PENDING","READY_FOR_REVIEW","PASS","FAIL","BLOCKED"]},"evidence_ids":{"type":"array","uniqueItems":true,"items":{"type":"string","pattern":"^EVD-[A-Z0-9][A-Z0-9._-]*$"}},"human_complete":{"type":"boolean"},"approved_visual_references":{"type":"array","uniqueItems":true,"items":{"type":"string","minLength":1}}},"additionalProperties":false},"integration_qa":{"type":"object","required":["status","evidence_ids"],"properties":{"status":{"enum":["PENDING","READY_FOR_REVIEW","PASS","FAIL","BLOCKED"]},"evidence_ids":{"type":"array","uniqueItems":true,"items":{"type":"string","pattern":"^EVD-[A-Z0-9][A-Z0-9._-]*$"}}},"additionalProperties":false},"human_acceptance":{"type":"object","required":["status","evidence_ids"],"properties":{"status":{"enum":["PENDING","APPROVED","REJECTED"]},"evidence_ids":{"type":"array","uniqueItems":true,"items":{"type":"string","pattern":"^EVD-[A-Z0-9][A-Z0-9._-]*$"}}},"additionalProperties":false},"evidence_ids":{"type":"array","uniqueItems":true,"items":{"type":"string","pattern":"^EVD-[A-Z0-9][A-Z0-9._-]*$"}}},"allOf":[{"if":{"properties":{"platform":{"const":"web"}},"required":["platform"]},"then":{"properties":{"inventory_ids":{"items":{"pattern":"^WEB-[0-9]{3}$"}}}}},{"if":{"properties":{"platform":{"const":"android"}},"required":["platform"]},"then":{"properties":{"inventory_ids":{"items":{"pattern":"^APP-[0-9]{3}$"}}}}},{"if":{"properties":{"platform":{"const":"ios"}},"required":["platform"]},"then":{"properties":{"inventory_ids":{"items":{"pattern":"^IOS-[0-9]{3}$"}}}}},{"if":{"properties":{"lifecycle_status":{"const":"FUNCTIONAL"}},"required":["lifecycle_status"]},"then":{"properties":{"definition_of_done":{"properties":{"status":{"const":"PASS"}}}}}},{"if":{"properties":{"lifecycle_status":{"const":"ACCEPTED"}},"required":["lifecycle_status"]},"then":{"properties":{"definition_of_done":{"properties":{"status":{"const":"PASS"}}},"visual_functional_review":{"properties":{"status":{"const":"PASS"},"human_complete":{"const":true}}},"integration_qa":{"properties":{"status":{"const":"PASS"}}},"human_acceptance":{"properties":{"status":{"const":"APPROVED"}}},"blocker":{"type":"null"}}}}],"additionalProperties":false}
