{"schema_version":"0.5.0","id":"operational-core","name":"Operational Core","platform":"web","inventory_ids":["WEB-001","WEB-004"],"dependencies":[],"api_binding":{"openapi_ref":"tests/fixtures/artifact-graph/openapi.yaml","revision":"api-rev-2","operation_ids":["loginUser","getDashboard"]},"client_architecture":{"artifact":"templates/client-architecture.web.example.json","gate_status":"PASS"},"lifecycle_status":"ACCEPTED","blocker":null,"definition_of_done":{"status":"PASS","checks":{"routing":"PASS","real_api":"PASS","auth_rbac":"PASS","forms_errors":"PASS","observability":"PASS","responsive":"PASS","accessibility":"PASS","tests":"PASS","traceability":"PASS","no_hardcoded_business_data":"PASS","no_invented_capabilities":"PASS","idempotency":"N/A","offline":"N/A"},"evidence_ids":["EVD-FUNC-001"]},"visual_functional_review":{"status":"PASS","evidence_ids":["EVD-REVIEW-001"],"human_complete":true,"approved_visual_references":[]},"integration_qa":{"status":"PASS","evidence_ids":["EVD-QA-001"]},"human_acceptance":{"status":"APPROVED","evidence_ids":["EVD-ACCEPT-001"]},"evidence_ids":["EVD-FUNC-001","EVD-REVIEW-001","EVD-QA-001","EVD-ACCEPT-001"]}
